{
  "schemaVersion": "provider-request-v1",
  "operationId": "op-01jk6m2w8g6wmx9zq7v4c2ac",
  "correlationId": "corr-01jk6m2w8g6wmx9zq7v4c2ab",
  "capability": "architecture-scenario-classification-v1",
  "scenario": {
    "schemaVersion": "architecture-scenario-v1",
    "scenarioId": "git-backed-correlation-cleanup",
    "title": "Git-governed terminal cleanup",
    "facts": [
      "Active correlation state is stored in S3.",
      "Terminal decisions are stored as public-safe GitHub tombstones.",
      "GitHub Actions invokes Cleanup Lambda through OIDC.",
      "Cleanup Lambda conditionally deletes an expected state revision."
    ],
    "questions": [
      "Is the authority for terminal decisions explicit?",
      "Can a stale tombstone delete newer active state?",
      "Does the portfolio remain usable when AWS is unavailable?"
    ]
  },
  "maximumResponseBytes": 16384
}
